{
  "schemaVersion": "retailer-observation-v3",
  "observationID": "obs-60000000-0000-4000-8000-000000000001-dg-chicken-value-3lb",
  "requirementID": "40000000-0000-4000-8000-000000000001",
  "retailerProductID": "dg-chicken-value-3lb",
  "sourceURL": "https://exo-robotics.github.io/smartcart-solari/website/solari-demo/retailer/product/dg-chicken-value-3lb.html",
  "title": "Demo Value Chicken Breasts",
  "packageDescription": "3 pound",
  "packageQuantity": 3,
  "packageUnit": "pound",
  "visiblePrice": 9.47,
  "currency": "USD",
  "observedAt": "2026-09-01T15:00:25Z",
  "confidence": "high",
  "ambiguityReasons": [],
  "proteinGramsPerPackage": null,
  "collectionMethod": "solari-browser-controlled-demo",
  "location": { "kind": "controlled-demo", "label": "SmartCart Demo Grocer synthetic catalog" },
  "catalogEra": "current-v3",
  "syntheticPrice": true,
  "freshness": { "status": "fresh", "ageSeconds": 5, "maxAgeSeconds": 86400 }
}
